keyword,title,description,link,pub_date,sentiment,nouns
라면,“희열을 느껴요” 손예윤 김포FC 리포터의 축구·팬 사랑으로 가득한 ...,하루 동안 끼니도 못 챙긴 손 리포터는 경기 후반이 돼서야 컵라면으로 첫 끼를 때웠다. 이날 김포가 2-1로 앞서다가 후반 막판 한 골을 먹힌 터라 수훈 선수 인터뷰는 없었다. 손예윤 리포터는 아쉬움을 뒤로하고 퇴근하는... ,https://m.sports.naver.com/kfootball/article/241/0003513916,"Tue, 09 Jun 2026 07:27:00 +0900",중립,"희열을, 느껴요, 손예윤, 김포, 리포터의"
라면,'윤승열♥︎' 김영희 &quot;짝사랑 임우일에게 17번 퇴짜 맞아→클럽서 '이모...,"너무 오래 앉아 있다가 화장실에 가려는데, 한 웨이터가 내 팔을 붙잡더니 '이모, 라면 하나만 끓여달라'고 하더라&quot;고 고백해 스튜디오를 그야말로 초토화시켰다. 그러나 김영희를 빛나게 한 건 매 순간 꺾이지 않았던... ",https://m.entertain.naver.com/article/109/0005549284,"Tue, 09 Jun 2026 07:21:00 +0900",중립,"윤승열, 김영희, 짝사랑, 임우일에게, 퇴짜"
라면,"트럼프, 사상 첫 NBA 파이널 직관 대통령…'사자굴' 뉴욕서 닉스와 정치...","NFL·UFC가 트럼프의 '홈 코트'라면, NBA는 그야말로 적진이다. 53년 만의 우승을 코앞에 둔 뉴욕 팬들이 대통령의 등장을 반길지, 야유를 보낼지도 이날의 관전 포인트이다.",https://www.dailysportshankook.co.kr/news/articleView.html?idxno=429468,"Tue, 09 Jun 2026 07:16:00 +0900",중립,"트럼프, 파이널, 직관, 대통령, 사자굴"
라면,"김영희, 임우일 4년 짝사랑 고백 “17번 퇴짜 맞았다”(말자쇼)",그는 “친구들과 달리 나는 자리만 지키고 있었다”며 “화장실에 가려는데 웨이터가 나를 붙잡고 ‘이모 라면 하나만 끓여달라’고 하더라”고 말해 폭소를 자아냈다. 김영희는 “그 후로 클럽을 안 간다. 나는 대화를... ,https://m.entertain.naver.com/article/382/0001277257,"Tue, 09 Jun 2026 07:15:00 +0900",중립,"김영희, 임우일, 짝사랑, 고백, 퇴짜"
라면,신라免 '토스페이' 도입·전자랜드 '명조' 팝업,"신라면세점이 신라인터넷면세점에 토스의 간편결제 서비스 '토스페이'를 신규 결제수단으로 도입했다. 사진=신라면세점 최근 내국인 고객의 간편결제 이용률이 50%를 넘어서고 네이버페이, 카카오페이 등 주요... ",https://www.slist.kr/news/articleView.html?idxno=744084,"Tue, 09 Jun 2026 07:10:00 +0900",중립,"신라, 토스페이, 도입, 전자랜드, 명조"
라면,"hy 포스트 브랜드 '아리', 글로벌 공략 선봉장",합작사 구조와 무관한 완전한 자체 브랜드인 데다 포스트바이오틱스 기술을 적용한 소다·에너지드링크·라면 등 상온 제품으로 구성돼 냉장 유통도 필요가 없다. 야쿠르트와 윌이 각각 법적·물리적으로 막혔던 두 가지... ,https://dealsite.co.kr/articles/163099,"Tue, 09 Jun 2026 07:06:00 +0900",중립,"포스트, 브랜드, 아리, 공략, 선봉장"
라면,‘말자쇼’ 김영희의 연애 조언,"김영희는 “입구에서 출입을 제지당해 돌아가려 했는데 친구가 항의한 덕분에 겨우 들어갔다”며 “안에서도 한 웨이터가 저를 붙잡고 ‘이모, 라면 하나만 끓여달라’고 했다”고 말해 현장을 웃음바다로 만들었다.... ",https://www.bntnews.co.kr/article/view/bnt202606090015,"Tue, 09 Jun 2026 07:06:00 +0900",중립,"말자쇼, 김영희의, 연애, 조언, 김영희는"
라면,"김영희, &quot;사랑은 용기가 필요해&quot;…임우일 짝사랑 17번 퇴짜 고백","그러다 자리를 일어나려던 찰나, 한 웨이터가 다가와 &quot;이모 라면 하나만 끓여달라&quot;고 말했다고 털어놨다. 뜻밖의 말을 들은 상황을 전한 뒤 김영희는 그 이후 클럽을 찾지 않게 됐다고 했다. 그러면서 &quot;나는 대화를 해야... ",https://www.topstarnews.net/news/articleView.html?idxno=16084221,"Tue, 09 Jun 2026 07:06:00 +0900",중립,"김영희, 사랑은, 용기가, 필요해, 임우일"
라면,"[6월 9일 캐시워크 돈버는퀴즈 종합]&quot;소이비랩,소휘, 신한 슈퍼SOL,모스...","'브리츠 오픈형 블루투스 이어폰'관련 문제는 &quot;운동이나 아웃도어 활동을 즐기는 분들이라면 배터리 걱정... 다섯번째 문제는 &quot;8cm접이식 코릭멀티쿠커는 라면, 햇반 뿐만 아니라 가열, 보온, 찜기 기능이 있어 자유롭고... ",http://www.economytalk.kr/news/articleView.html?idxno=421831,"Tue, 09 Jun 2026 07:02:00 +0900",중립,"캐시워크, 돈버는퀴즈, 종합, 소이비랩, 소휘"
라면,"노영희 &quot;李 기자회견, 정청래에 '너 때문에 졌어' 말한 셈&quot;[한판승부]","◆ 장성철&gt; 반정청래의 깃발을 들고 이번 당 대표 선거 때 정청래 대표 당 대표 안 되게 하기 위해서 자기가 도시락 싸들고 자발적으로 할 거 아니에요, 이렇다라면 정청래 대표가 민주당의 근거지가 저렇게 분열되고... ",https://n.news.naver.com/mnews/article/079/0004155621?sid=100,"Tue, 09 Jun 2026 07:01:00 +0900",중립,"노영희, 기자회견, 정청래에, 때문에, 졌어"
라면,NC ‘주차장 듀오’의 반란이 시작됐다,MBTI로 따졌을 때 오장한이 내향적인 ‘I’라면 박시원은 활달한 ‘E’ 성향이다. 그런 두 사람이 팀 내 가장 절친한 사이다. 오장한은 “시원이 형이 워낙 성격이 좋다. 처음부터 먼저 다가와 줘서 정말 고마웠다”고... ,https://m.sports.naver.com/kbaseball/article/144/0001119699,"Tue, 09 Jun 2026 07:00:00 +0900",중립,"주차장, 듀오, 반란이, 시작됐다, 따졌을"
라면,"'44세' 김지석, ♥12살 연하 여자친구 신경 쓰나 &quot;저속노화 관리 시작&quot; ...","그는 건강하게 나이 드는 ‘웰에이징’을 목표로 관리한다며 라면, 떡볶이, 튀김 등 밀가루 음식 섭취를 끊었고 커피도 하루 한 잔만 마신다고 말해 놀라움을 자아냈다. 한편, 김지석과 이주명은 2024년 8월부터 조용히... ",https://m.entertain.naver.com/article/109/0005549267,"Tue, 09 Jun 2026 06:32:00 +0900",중립,"김지석, 연하, 여자친구, 신경, 쓰나"
라면,[뉴스톡톡]삼겹살에 소맥·치킨까지…젠슨 황이 띄운 'K-푸드',이어 &quot;과거에는 라면이나 김치 등 수출 제품 중심으로 K-푸드를 설명했다면 이제는 한국식 외식 문화 자체가 콘텐츠가 되고 있다&quot;며 &quot;황 CEO의 방한 기간 가장 많이 노출된 음식이 삼겹살과 치킨이었다는 점도 시사하는... ,https://n.news.naver.com/mnews/article/421/0008992617?sid=101,"Tue, 09 Jun 2026 06:30:00 +0900",중립,"뉴스톡톡, 삼겹살에, 소맥, 치킨까지, 젠슨"
라면,[황승연의 타임캡슐] 노인과 바다 …빈집과 절벽,일본이 ‘감소 사회’라면 한국은 ‘소멸 사회’에 가깝다. 수도권 집중도 일본보다 심하다. 일본은 도쿄 집중이 심하지만 오사카·나고야·후쿠오카 등 거점이 유지되고 있다. 한국은 서울 집중이 압도적이다. 수도권에... ,https://www.ajunews.com/view/20260607095926703,"Tue, 09 Jun 2026 06:02:00 +0900",중립,"황승연의, 타임캡슐, 노인과, 바다, 빈집과"
라면,"[스브스夜] '아근진' 김지석, &quot;옥스퍼드대 수학과 수석 큰 형, 막내는 1...","김지석은 &quot;커피도 하루 한 잔으로 줄이고 라면, 떡볶이, 튀김 아예 끊었다&quot;라고 동안 비결을 공개했다. 한편 이날 방송 말미에는 티파니와 김예원, 아일릿의 출연이 예고되어 다음 방송에 대한 기대감을 높였다.",https://m.entertain.naver.com/article/416/0000324006,"Tue, 09 Jun 2026 04:24:00 +0900",긍정,"스브스, 아근진, 김지석, 옥스퍼드대, 수학과"
라면,"뉴, 그레이 헤어 셀카로 전한 근황…반짝이는 액세서리 포인트","숙소에서는 라면과 김치찜, 계란말이 등을 자주 만들며 멤버들을 챙기는 요리 담당으로도 소개된다. 한편, 뉴는 최근 팀과 소속사를 둘러싼 논란과 관련해 자신의 입장을 직접 전했다. 지난 3월 더보이즈 멤버... ",https://www.topstarnews.net/news/articleView.html?idxno=16084029,"Tue, 09 Jun 2026 04:20:00 +0900",중립,"그레이, 헤어, 셀카로, 전한, 근황"
라면,"김지석, '띠동갑' 이주명과 열애 언급..&quot;알아서 잘하는 남편 되고파&quot;[아...","이어 &quot;라면, 떡볶이, 튀김 같은 밀가루 음식은 아예 끊었다&quot;며 &quot;아침마다 밀싹 가루와 올리브유, 영양제를 챙겨 먹고 있다&quot;고 전했다. 한편 김지석은 지난 2024년 8월 배우 이주명과 열애를 인정했다. 두 사람은 '띠동갑 커플... ",https://m.entertain.naver.com/article/108/0003442477,"Mon, 08 Jun 2026 23:50:00 +0900",중립,"김지석, 띠동갑, 이주명과, 열애, 언급"
